{
  "$schema": "https://json-schema.org/draft/2020-12/schema",
  "$id": "https://agenticterminal.ai/schema/merchant.schema.json",
  "title": "AT Directory Merchant",
  "description": "A merchant indexed by the Agentic Terminal Directory. One JSON file per merchant under data/merchants/<id>.json.",
  "type": "object",
  "required": [
    "id",
    "name",
    "url",
    "description",
    "category",
    "rails",
    "op_trust_tier",
    "agent_callable_tier",
    "accepts_usdc",
    "accepts_x402",
    "pricing_model",
    "source"
  ],
  "additionalProperties": false,
  "properties": {
    "id": {
      "type": "string",
      "pattern": "^[a-z0-9][a-z0-9-]{0,63}$",
      "description": "Stable slug-form identifier. Filename must match: data/merchants/<id>.json."
    },
    "name": { "type": "string", "minLength": 1 },
    "url": { "type": "string", "format": "uri" },
    "description": { "type": "string", "minLength": 1 },
    "category": { "$ref": "#/$defs/Category" },
    "rails": {
      "type": "array",
      "minItems": 1,
      "items": { "$ref": "#/$defs/Rail" }
    },
    "op_trust_tier": { "enum": [1, 2, 3] },
    "agent_callable_tier": {
      "enum": ["full-api", "structured-handoff", "human-checkout"]
    },
    "agent_endpoints": { "$ref": "#/$defs/AgentEndpoints" },
    "payment_protocols": {
      "type": "array",
      "uniqueItems": true,
      "items": { "enum": ["mpp", "x402"] },
      "description": "Agent-payment protocols this merchant accepts. A merchant that accepts one of these qualifies for the directory on the protocol alone, whatever it settles in, fiat included: the protocol is what makes the purchase machine-completable, and the settlement rail is a property of the record rather than a gate on it (ruled by Boyd 2026-09-15). Only protocols we can evidence are in the enum. x402 and MPP are here because records carry evidence for them; ACP, AP2, UCP, Mastercard Agent Pay and Visa TAP are not, and adding a value means having a record that evidences it, not naming it. `accepts_x402` is the older single-protocol boolean and must agree with this array, which packages/core/src/load.ts enforces on every load."
    },
    "accepts_usdc": { "type": "boolean" },
    "accepts_x402": { "type": "boolean" },
    "pricing_model": {
      "enum": ["subscription", "per-product", "per-request", "variable", "free"]
    },
    "last_verified_at": {
      "type": ["string", "null"],
      "format": "date-time"
    },
    "source": { "enum": ["crawled", "self-registered", "integrated"] },
    "source_attribution": { "type": "string" },
    "op_attestation_url": {
      "type": ["string", "null"],
      "format": "uri"
    },
    "merchant_did": {
      "type": ["string", "null"],
      "pattern": "^did:[a-z]+:[^/\\s#?]+$",
      "description": "The merchant's DID. No slashes in the DID string — path segments are colon-separated. Default for AT-hosted: did:web:agenticterminal.ai:merchants:<id> (note colons, not slashes). Resolves to https://agenticterminal.ai/merchants/<id>/did.json (colons map to slashes only in the resolved URL). Null until the merchant's DID document is provisioned. Once populated, this is the credentialSubject.id used in MerchantTrustCredentials issued for this merchant."
    },
    "merchant_vc_url": {
      "type": ["string", "null"],
      "format": "uri",
      "description": "Stable URL where this merchant's current MerchantTrustCredential is served (JSON-LD). Convention: https://agenticterminal.ai/merchants/<id>/trust-credential.jsonld. Null until Tier 1 issuance goes live."
    },
    "merchant_controlled_key_ref": {
      "type": ["string", "null"],
      "description": "Optional. Fragment identifier of a merchant-controlled key included in the merchant's AT-hosted DID document (e.g. '#merchant-key-1'). When present, enables holder-binding and Tier 4 A2A mutual verification for this merchant. Null for merchants using AT-hosted default only.",
      "default": null
    },
    "participant_type": {
      "enum": ["merchant", "agent"],
      "description": "Distinguishes the kind of participant posting this listing. Defaults to 'merchant' when absent."
    },
    "is_challenge": {
      "type": "boolean",
      "description": "When true, this open-call is a competitive challenge with a prize. Only meaningful when listing_type is 'open-call'."
    },
    "challenge_prize": {
      "type": ["string", "null"],
      "description": "Free-form prize or bounty description. Any currency. E.g. '500k sats', '$500 USDT'. Null until filled."
    },
    "challenge_deadline": {
      "type": ["string", "null"],
      "format": "date-time",
      "description": "Submission deadline. Null if open-ended."
    },
    "challenge_who_can_apply": {
      "enum": ["agents"],
      "description": "Who may apply to this challenge. Tasks are executed by agents on behalf of human posters."
    },
    "challenge_status": {
      "enum": ["open", "judging", "paused", "closed", "winner"],
      "description": "Lifecycle state of the open call. 'paused' is distinct from 'closed': a paused call is still shown, with its reason, because a call that stops accepting work and vanishes is indistinguishable from one that was silently withdrawn. See apps/web/lib/display-policy.ts — 'closed' and 'winner' hide the listing, 'paused' does not."
    },
    "listing_type": {
      "enum": ["offer", "open-call"],
      "description": "Whether this listing is an offer of services (offer) or a request seeking providers (open-call). Defaults to 'offer' when absent."
    },
    "price_display": {
      "type": ["string", "null"],
      "description": "Human-readable price or budget string shown on marketplace cards. Free-form — not parsed or enforced. Examples: '5000 sats / request', '0.01 BTC for 90 days', 'Negotiate per task'. Null = not specified."
    },
    "terms_url": {
      "type": ["string", "null"],
      "format": "uri",
      "description": "Where the full, dated terms of this listing are published. Set on any open call whose terms are longer than its description — a bounty's rate, cap and adjudication standard are read by agents before they spend effort, so the link has to be a field they can read, not prose buried in the description. Null when the description is the whole of the terms."
    },
    "contact_url": {
      "type": ["string", "null"],
      "format": "uri",
      "description": "How parties connect off-platform to negotiate and settle. AT facilitates discovery only — no escrow, no routing, no custody. Null = stub / TBD."
    },
    "logo_url": { "type": "string" },
    "tags": {
      "type": "array",
      "items": { "type": "string", "minLength": 1 },
      "uniqueItems": true
    },
    "posted_at": {
      "type": ["string", "null"],
      "format": "date-time",
      "description": "When this open-call was first posted. Null for legacy records or ongoing offers."
    },
    "poster_name": {
      "type": ["string", "null"],
      "description": "Display name of the entity posting this open-call. Free-form. E.g. 'Observer Protocol', 'ArcadiaB', an X handle."
    },
    "poster_did": {
      "type": ["string", "null"],
      "description": "DID of the entity posting this open-call. Shown on the task card. Verified = resolved against live DID document. Null for legacy or anonymous posts."
    },
    "poster_did_verified": {
      "type": ["boolean", "null"],
      "description": "Whether the poster's DID was successfully resolved and validated at submission time."
    },
    "pinned": {
      "type": ["boolean", "null"],
      "description": "When true, this listing is surfaced/promoted by AT editors. Pinned open-calls sort first on the task board."
    }
  },
  "$defs": {
    "Category": {
      "enum": [
        "gift-cards",
        "travel",
        "vpn-privacy",
        "hosting-domains",
        "physical-goods",
        "content-creator",
        "marketplace",
        "compute",
        "communication",
        "payment-network",
        "concierge",
        "gaming",
        "agent-services",
        "proxy"
      ]
    },
    "Rail": {
      "type": "object",
      "required": ["rail", "health"],
      "additionalProperties": false,
      "properties": {
        "rail": { "enum": ["lightning", "bolt12", "l402", "usdt", "usdc", "btc", "fiat"] },
        "chain": {
          "enum": ["tron", "ethereum", "solana", "bsc", "polygon", "arbitrum", "base"],
          "description": "Required when rail is a token rail ('usdt' or 'usdc') — the same asset settles on several chains and an agent cannot pay without knowing which. Forbidden on every other rail."
        },
        "payment_endpoint": {
          "type": ["string", "null"],
          "description": "The rail-specific endpoint the verifier probes. PRECONDITION BEFORE ADDING THE FIRST LIGHTNING ADDRESS OR BECH32 LNURL: the verifier resolves those by fetching the URL and READING THE BODY, and it currently follows redirects with no destination revalidation. The bounded follow-with-revalidation loop must land before or with that first entry - see op-at-specs/2026-07-28-at-directory-mcp-redirect-guard-scoping.md. Without it, redirect:manual silently downgrades healthy providers to degraded, and redirect:follow lets the merchant choose where our IP goes. Zero merchants declare one today, which is exactly why this is cheap now and a retrofit later."
        },
        "health": { "enum": ["healthy", "degraded", "down", "unknown"] },
        "last_health_check": {
          "type": ["string", "null"],
          "format": "date-time"
        }
      },
      "allOf": [
        {
          "if": { "properties": { "rail": { "enum": ["usdt", "usdc"] } } },
          "then": { "required": ["chain"] },
          "else": { "not": { "required": ["chain"] } }
        }
      ]
    },
    "AgentEndpoints": {
      "type": "object",
      "additionalProperties": false,
      "properties": {
        "mcp_server": {
          "type": "string",
          "pattern": "^(npm:|https?:)",
          "description": "How to install or connect. Prefix: 'npm:' for local install, 'http:'/'https:' for remote MCP endpoint."
        },
        "auth_note": {
          "type": "string",
          "description": "Short, agent-readable description of how the merchant authenticates — credential type, where to obtain it, how to attach."
        },
        "rest_api": {
          "type": "string",
          "pattern": "^https?:",
          "description": "Base URL of a parallel REST API surface for agents that prefer REST over MCP. A connection surface like mcp_server (not documentation)."
        },
        "api_docs": { "type": "string", "format": "uri" },
        "openapi_url": { "type": "string", "format": "uri" }
      }
    }
  }
}
