{
  "id": "rad-web",
  "name": "Rad Web Hosting",
  "url": "https://radwebhosting.com",
  "description": "Cloud and web hosting accepting crypto payments.",
  "category": "hosting-domains",
  "rails": [
    {
      "rail": "lightning",
      "payment_endpoint": null,
      "health": "unknown",
      "last_health_check": null
    }
  ],
  "op_trust_tier": 1,
  "agent_callable_tier": "human-checkout",
  "accepts_usdc": false,
  "accepts_x402": false,
  "pricing_model": "subscription",
  "last_verified_at": "2026-07-29T17:42:20Z",
  "source": "crawled",
  "op_attestation_url": null,
  "tags": [
    "hosting",
    "rail-unverified"
  ]
}
