{
  "id": "expressvpn",
  "name": "ExpressVPN",
  "url": "https://www.expressvpn.com",
  "description": "Major global VPN provider. Crypto accepted via BitPay direct checkout, including BTC, USDT, and USDC; crypto payments do not auto-renew.",
  "category": "vpn-privacy",
  "rails": [
    {
      "rail": "btc",
      "payment_endpoint": null,
      "health": "unknown",
      "last_health_check": null
    },
    {
      "rail": "usdt",
      "chain": "ethereum",
      "payment_endpoint": null,
      "health": "unknown",
      "last_health_check": null
    }
  ],
  "op_trust_tier": 1,
  "agent_callable_tier": "human-checkout",
  "accepts_usdc": true,
  "accepts_x402": false,
  "pricing_model": "subscription",
  "last_verified_at": "2026-07-29T17:42:20Z",
  "source": "crawled",
  "op_attestation_url": null,
  "tags": ["vpn", "privacy", "bitpay"]
}
