{
  "id": "wavlake",
  "name": "Wavlake",
  "url": "https://www.wavlake.com",
  "description": "Music platform paying artists directly over Lightning.",
  "category": "content-creator",
  "rails": [
    {
      "rail": "lightning",
      "payment_endpoint": null,
      "health": "unknown",
      "last_health_check": null
    }
  ],
  "op_trust_tier": 1,
  "agent_callable_tier": "human-checkout",
  "accepts_usdc": false,
  "accepts_x402": false,
  "pricing_model": "variable",
  "last_verified_at": "2026-07-29T17:42:20Z",
  "source": "crawled",
  "op_attestation_url": null,
  "tags": [
    "music",
    "value4value"
  ]
}
