{
  "id": "aeon-pay",
  "name": "AEON Pay",
  "url": "https://aeon.xyz",
  "description": "Crypto payment app and merchant network accepting USDT across a broad downstream merchant base.",
  "category": "payment-network",
  "rails": [
    {
      "rail": "usdt",
      "chain": "tron",
      "payment_endpoint": null,
      "health": "unknown",
      "last_health_check": null
    }
  ],
  "op_trust_tier": 1,
  "agent_callable_tier": "structured-handoff",
  "accepts_usdc": false,
  "accepts_x402": false,
  "pricing_model": "variable",
  "last_verified_at": "2026-07-29T17:42:20Z",
  "source": "crawled",
  "op_attestation_url": null,
  "tags": [
    "payments",
    "merchant-network"
  ]
}
