{
  "id": "starbackr",
  "name": "Starbackr",
  "url": "https://starbackr.com",
  "description": "Creator monetization platform settling in Lightning.",
  "category": "content-creator",
  "rails": [
    {
      "rail": "lightning",
      "payment_endpoint": null,
      "health": "unknown",
      "last_health_check": null
    }
  ],
  "op_trust_tier": 1,
  "agent_callable_tier": "human-checkout",
  "accepts_usdc": false,
  "accepts_x402": false,
  "pricing_model": "variable",
  "last_verified_at": null,
  "source": "crawled",
  "op_attestation_url": null,
  "tags": [
    "unreachable-2026-07-29",
    "unreachable-timeout",
    "creators",
    "monetization"
  ]
}
