{
  "id": "voltage",
  "name": "Voltage",
  "url": "https://voltage.cloud",
  "description": "Hosted Lightning node and infrastructure, billed and payable over Lightning.",
  "category": "compute",
  "rails": [
    {
      "rail": "lightning",
      "payment_endpoint": null,
      "health": "unknown",
      "last_health_check": null
    }
  ],
  "op_trust_tier": 1,
  "agent_callable_tier": "structured-handoff",
  "accepts_usdc": false,
  "accepts_x402": false,
  "pricing_model": "subscription",
  "last_verified_at": "2026-07-29T17:42:20Z",
  "source": "crawled",
  "op_attestation_url": null,
  "tags": [
    "lightning-infra",
    "hosting",
    "node"
  ]
}
