{
  "id": "silent-link",
  "name": "Silent.link",
  "url": "https://silent.link",
  "description": "Anonymous global eSIM and mobile data, payable in Bitcoin, Lightning, Monero, or USDT.",
  "category": "communication",
  "rails": [
    {
      "rail": "lightning",
      "payment_endpoint": null,
      "health": "unknown",
      "last_health_check": null
    },
    {
      "rail": "usdt",
      "chain": "tron",
      "payment_endpoint": null,
      "health": "unknown",
      "last_health_check": null
    }
  ],
  "op_trust_tier": 1,
  "agent_callable_tier": "human-checkout",
  "accepts_usdc": false,
  "accepts_x402": false,
  "pricing_model": "per-product",
  "last_verified_at": "2026-07-29T17:42:20Z",
  "source": "crawled",
  "op_attestation_url": null,
  "tags": [
    "esim",
    "mobile-data",
    "privacy",
    "anonymous",
    "rail-unverified"
  ]
}
